{
  "schema_version": "1.0",
  "id": "PERF-EXAMPLE-001",
  "status": "proposed",
  "scope": "example-scope",
  "operation": "TODO: describe the operation and its entry point",
  "paths": ["TODO: relevant source paths"],
  "command_id": "TODO: command id from config.json",
  "oracle_id": "TODO: independent correctness oracle",
  "workload": {
    "dimension": "TODO: named workload dimension",
    "sizes": [250, 500, 1000, 2000],
    "fixed": {},
    "cache_state": "none"
  },
  "assertions": [
    {"metric": "TODO: correctness metric", "operator": "eq", "value": true}
  ],
  "profile": "pr",
  "baseline_ref": "TODO-reference-v1"
}
